date_implemented,date_lifted,measure,level,unit,source
27.02.2020,NA,Start BAG information campaign,federal,CH,NA
27.02.2020,NA,engadin skimarathon cancelled,private,GR,NA
27.02.2002,15.03.2020,ban on school trips,canton,GR,NA
28.02.2020,15.03.2020,ban on events with more than 1000 persons,federal,CH,NA
28.02.2020,15.03.2020,for events with less than 1000 persons an evaluation with cantonal authorities is required,federal,CH,NA
28.02.2020,NA,no carnival,canton,TI,NA
28.02.2020,NA,no ice hockey matches,canton,TI,NA
28.02.2020,NA,ban events larger than 1000 persons,canton,TI,NA
28.02.2020,NA,meldepflicht for events smaller than 1000 persons,canton,TI,NA
28.02.2020,NA,partial Kurzarbeitszeit,canton,TI,NA
28.02.2020,NA,canceled Espoprofessioni on 9.03.2020 (Job fair),canton,TI,NA
28.02.2020,NA,school ski camps not canceled,canton,NE,NA
04.03.2020,15.03.2020,ban on all events with more than 500 persons,canton,NE,NA
04.03.2020,15.03.2020,meldepflicht for events smaller than 500 persons,canton,NE,NA
04.03.2020,15.03.2020,cancelled school trips and ski camps,canton,NE,NA
02.03.2020,NA,Updated BAG information campaign,federal,CH,NA
03.03.2020,NA,Testing covered by health insurance,federal,CH,NA
07.03.2020,NA,banned events larger than 150 persons,canton,TI,NA
07.03.2020,NA,at risk groups invited to be careful,canton,TI,NA
07.03.2020,NA,official BAG flyers must be affixed at entrance of all events,canton,TI,NA
09.03.2020,NA,pre-triage at hospital entrance,canton,SH,NA
11.03.2020,29.03.2020,stato di necessità,canton,TI,NA
11.03.2020,NA,civil protection only calls non-medical personell,canton,TI,NA
11.03.2020,NA,recommendation to follow hygiene prescriptions,canton,TI,NA
11.03.2020,NA,"at risk groups should avoid several activties (childcare, public transport, events)",canton,TI,NA
11.03.2020,NA,closure of public places of entertainment and leisure,canton,TI,NA
11.03.2020,NA,banned sports events,canton,TI,NA
11.03.2020,NA,restaurants and hotels can only host less than 50 persons,canton,TI,NA
11.03.2020,NA,social distancing,canton,TI,NA
11.03.2020,NA,ban events larger than 50 persons,canton,TI,NA
11.03.2020,NA,schools stay open,canton,TI,NA
12.03.2020,29.03.2020,post-obligatory schools close,canton,TI,NA
13.03.2020,30.04.2020,ausserordentliche Lage,canton,GR,NA
14.03.2020,30.04.2020,event ban for events larger than 50 persons,canton,GR,NA
14.03.2020,30.04.2020,ban for religious functions larger than 50 persons,canton,GR,NA
14.03.2020,30.04.2020,ban on hopsital and retirement home visits,canton,GR,NA
14.03.2020,30.04.2020,closure of all leisure and entertainment places,canton,GR,NA
14.03.2020,30.04.2020,restaurants and hotels can open if respecting hygiene and distance guidelines,canton,GR,NA
16.03.2020,30.04.2020,ski areas must close,canton,GR,NA
16.03.2020,30.04.2020,swiss army stops recruitment,federal,CH,NA
14.03.2020,NA,hospitals cannot perform non-lifesaving or urgent procedure,canton,GR,NA
16.03.2020,30.04.2020,no physical teaching in secondary and tertiary schools,canton,GR,NA
16.03.2020,30.04.2020,civil service employees must work from home when possible,canton,GR,NA
16.03.2020,NA,school closed,canton,AG,NA
16.03.2020,NA,avoid all necessary tranposrt,federal,CH,NA
16.03.2020,NA,ban on event with more than 100 persons,canton,AG,NA
16.03.2020,30.04.2020,all non-essential stores and restaurants closed,canton,GR,NA
16.03.2020,NA,emergency state declared,canton,VD,NA
16.03.2020,NA,ban on all events,canton,VD,NA
16.03.2020,NA,ban on gathering of more than 10 people,canton,VD,NA
16.03.2020,NA,ban all sports that don't allow distancing,canton,VD,NA
16.03.2020,NA,ban on religious functions with more than 10 people,canton,VD,NA
16.03.2020,NA,closure of all non necessary shops,canton,VD,NA
16.03.2020,NA,companies must force home office whenever possible,canton,VD,NA
16.03.2020,NA,companies only need to ask medical certificate after 10 days medical leave,canton,VD,NA
16.03.2020,NA,ban on hopsital and retirement home visits,canton,VD,NA
13.03.2020,30.04.2020,distance teaching,canton,VD,NA
13.03.2020,30.04.2020,ban on events with more than 50 persons,canton,VD,NA
13.03.2020,30.04.2020,closure of all leisure and entertainment places,canton,VD,NA
13.03.2020,NA,entry ban from high risk countries,federal,CH,NA
13.03.2020,NA,event with less than 1000 persons can be held if percautions are taken,federal,CH,NA
16.03.2020,30.04.2020,event ban for events larger than 100 persons,federal,CH,NA
16.03.2020,30.04.2020,"restaurants, nightclubs and bars cannot host more than 50 persons",federal,CH,NA
16.03.2020,30.04.2020,events with less than 100 persons are permitted under special hygiene and distance conditons,federal,CH,NA
16.03.2020,04.04.2020,school closure,federal,CH,NA
17.03.2020,30.04.2020,closure of non necessary stores,federal,CH,NA
17.03.2020,30.04.2020,explicit social distancing,federal,CH,NA
17.03.2020,30.04.2020,event ban,federal,CH,NA
19.03.2020,NA,construction work can stay open,canton,AG,NA
13.03.2020,NA,"the cantons must provide information on hopspital beds, ICU, medical material etc",federal,CH,NA
14.03.2020,NA,the use of eye protective gear is recommended,federal,CH,NA
14.03.2020,NA,the use of surgical masks is recommended for all medical and care personel,federal,CH,NA
14.03.2020,NA,the use of FFP2/FFP3 masks is recommended for all procedures with risk of areosol formation,federal,CH,NA
14.03.2020,NA,the use of surgical masks is not recommended for the population,federal,CH,NA
15.03.2020,NA,people invited to stay home unless necessary,canton,TI,NA
15.03.2020,NA,ban events larger than 30 persons,canton,TI,NA
15.03.2020,04.04.2020,school closure,canton,TI,NA
15.03.2020,NA,school can offer daycare services,canton,TI,NA
15.03.2020,NA,ban on religious functions,canton,TI,NA
15.03.2020,NA,ban on public funerals,canton,TI,NA
15.03.2020,29.03.2020,all non-essential stores closed,canton,TI,NA
15.03.2020,NA,all other economic activities reduced to the minimum,canton,TI,NA
17.03.2020,NA,ban on hopsital and retirement home visits,canton,ZH,NA
19.03.2020,21.03.2020,all economic and commercial activities closed,canton,TI,NA
19.03.2020,NA,SBB greatly reduces train services,federal,CH,NA
18.03.2020,NA,all stores must close at 18:00,canton,TI,NA
18.03.2020,NA,municipal elections moved to 2021,canton,TI,NA
18.03.2020,NA,ban on all public and private events,canton,TI,NA
21.03.2020,NA,hospitals cannot perform non-lifesaving or urgent procedure,canton,ZH,NA
17.03.2020,NA,classification of hospitals in covid and non covid,canton,ZH,NA
17.03.2020,NA,hospitals must train their staff in intensive care,canton,ZH,NA
17.03.2020,NA,special precautions (bodybag) during the burial of covid2019 patients,canton,ZH,NA
17.03.2020,NA,Ban gatherings of more than 5 people,canton,JU,NA
19.03.2020,NA,Exit restriction for people over 65,canton,UR,NA
20.03.2020,NA,city of Zürich closes parks,city,Zürich,NA
06.02.2020,NA,persons returning from China and showing symptomps must contact their doctos,canton,SG,https://www.sg.ch/tools/informationen-coronavirus/medieninformation-coronavirus/_jcr_content/Par/sgch_downloadlist_30/DownloadListPar/sgch_download_1749545883.ocFile/Medienmitteilung%20Information%2006.02..pdf
06.02.2020,NA,hotline activated,SG,https://www.sg.ch/tools/informationen-coronavirus/medieninformation-coronavirus/_jcr_content/Par/sgch_downloadlist_30/DownloadListPar/sgch_download_1749545883.ocFile/Medienmitteilung%20Information%2006.02..pdf,NA
25.02.2020,NA,hygiene rules for the population published,canton,SG,https://www.sg.ch/tools/informationen-coronavirus/medieninformation-coronavirus/_jcr_content/Par/sgch_downloadlist_30/DownloadListPar/sgch_download_1391405191.ocFile/Medienmitteilung%20Hygieneregeln%20Coronavirus.pdf
28.02.2020,NA,ice hockey match HC Lugano vs  SC Rapperswil-Jona Lakers is played without spectators,canton,SG,https://www.sg.ch/tools/informationen-coronavirus/medieninformation-coronavirus/_jcr_content/Par/sgch_downloadlist_30/DownloadListPar/sgch_download_111491988.ocFile/Medienmitteilung%20Match%20SC%20Rapperswil-Jona%20Lakers.pdf
28.02.2020,NA,no specific measures for events with less than 1000 persons,canton,SG,https://www.sg.ch/tools/informationen-coronavirus/medieninformation-coronavirus/_jcr_content/Par/sgch_downloadlist_30/DownloadListPar/sgch_download.ocFile/Medienmitteilung%20Weisung%20Anl%C3%A4sse.pdf
04.03.2020,NA,events with more than 150 persons must register online,canton,SG,https://www.sg.ch/tools/informationen-coronavirus/medieninformation-coronavirus/_jcr_content/Par/sgch_downloadlist_30/DownloadListPar/sgch_download_861503390.ocFile/Medienmitteilung%20%C3%84nderung%20Weisung%20Veranstaltungen%20SG.pdf
04.03.2020,NA,recommendation to keep social distanc,canton,SG,https://www.sg.ch/tools/informationen-coronavirus/medieninformation-coronavirus/_jcr_content/Par/sgch_downloadlist_30/DownloadListPar/sgch_download_861503390.ocFile/Medienmitteilung%20%C3%84nderung%20Weisung%20Veranstaltungen%20SG.pdf
10.03.2020,NA,event organisers don't have to ask if participants came from risk areas as all areas are considered at risk,canton,SG,https://www.sg.ch/tools/informationen-coronavirus/medieninformation-coronavirus/_jcr_content/Par/sgch_downloadlist_30/DownloadListPar/sgch_download_187632073.ocFile/Medienmitteilung%20Anpassung%20Weisung%20Veranstaltungen%20SG.pdf
12.03.2020,NA,tertiary education should be offered at distance whenever possible,canton,SG,https://www.sg.ch/tools/informationen-coronavirus/medieninformation-coronavirus/_jcr_content/Par/sgch_downloadlist_30/DownloadListPar/sgch_download_1010940708.ocFile/Medienmitteilung%20Distance%20Learning%20Hochschulen%20SG.docx.pdf
14.03.2020,04.04.2020,distance teachins,canton,SG,https://www.sg.ch/tools/informationen-coronavirus/medieninformation-coronavirus/_jcr_content/Par/sgch_downloadlist_30/DownloadListPar/sgch_download_1028877548.ocFile/Medienmitteilung%20Bundesratsentscheid%20Auswirkungen%20SG.pdf
14.03.2020,04.04.2020,events with less than 100 persons can be held with special conditions,canton,SG,https://www.sg.ch/tools/informationen-coronavirus/medieninformation-coronavirus/_jcr_content/Par/sgch_downloadlist_30/DownloadListPar/sgch_download_1028877548.ocFile/Medienmitteilung%20Bundesratsentscheid%20Auswirkungen%20SG.pdf
14.03.2020,04.04.2020,restaurants and bars cannot host more than 50 persons,canton,SG,https://www.sg.ch/tools/informationen-coronavirus/medieninformation-coronavirus/_jcr_content/Par/sgch_downloadlist_30/DownloadListPar/sgch_download_1028877548.ocFile/Medienmitteilung%20Bundesratsentscheid%20Auswirkungen%20SG.pdf
16.03.2020,30.04.2020,restriction on hopsital and retirement home visits,canton,SG,https://www.sg.ch/tools/informationen-coronavirus/medieninformation-coronavirus/_jcr_content/Par/sgch_downloadlist_30/DownloadListPar/sgch_download_1226681471.ocFile/Medienmitteilung%20Entscheide%20Regierung%20nach%20Bundesratsentscheid%20SG.pdf
16.03.2020,NA,ballot box elections instead of assemblies,canton,SG,https://www.sg.ch/tools/informationen-coronavirus/medieninformation-coronavirus/_jcr_content/Par/sgch_downloadlist_30/DownloadListPar/sgch_download_1226681471.ocFile/Medienmitteilung%20Entscheide%20Regierung%20nach%20Bundesratsentscheid%20SG.pdf
16.03.2020,NA,at risk groups invited to stay home,canton,SG,https://www.sg.ch/tools/informationen-coronavirus/medieninformation-coronavirus/_jcr_content/Par/sgch_downloadlist_30/DownloadListPar/sgch_download_59923961.ocFile/Medienmitteilung%20der%20Regierung%20zum%20Coronavirus%20SG.pdf
16.03.2020,NA,cantonal hotline opened,canton,SG,https://www.sg.ch/tools/informationen-coronavirus/medieninformation-coronavirus/_jcr_content/Par/sgch_downloadlist_30/DownloadListPar/sgch_download_59923961.ocFile/Medienmitteilung%20der%20Regierung%20zum%20Coronavirus%20SG.pdf
16.03.2020,NA,asked army assistance,canton,SG,https://www.sg.ch/tools/informationen-coronavirus/medieninformation-coronavirus/_jcr_content/Par/sgch_downloadlist_30/DownloadListPar/sgch_download_59923961.ocFile/Medienmitteilung%20der%20Regierung%20zum%20Coronavirus%20SG.pdf
16.03.2020,NA,day care centers must stay open,canton,SG,https://www.sg.ch/tools/informationen-coronavirus/medieninformation-coronavirus/_jcr_content/Par/sgch_downloadlist_30/DownloadListPar/sgch_download_59923961.ocFile/Medienmitteilung%20der%20Regierung%20zum%20Coronavirus%20SG.pdf
19.03.2020,NA,cantonal services are reduced,canton,SG,https://www.sg.ch/tools/informationen-coronavirus/medieninformation-coronavirus/_jcr_content/Par/sgch_downloadlist_30/DownloadListPar/sgch_download_1854498657.ocFile/MM%20Dienstleistungen.pdf
28.02.2020,NA,events with between 150 and 999 people are subjects to authorization,cantonal,AG,https://www.ag.ch/de/aktuelles/medienportal/medienmitteilung/medienmitteilungen/mediendetails_138709.jsp
12.03.2020,NA,establishment of a telephone hotline by the cantonal medical association,cantonal (private),AG,https://www.ag.ch/de/aktuelles/medienportal/medienmitteilung/medienmitteilungen/mediendetails_139093.jsp
12.03.2020,NA,private clinics and general practitioners are allowed to carry out coronavirus-tests,cantonal,AG,https://www.ag.ch/de/aktuelles/medienportal/medienmitteilung/medienmitteilungen/mediendetails_139093.jsp
16.03.2020,20.04.2020,schools closed,cantonal,AG,https://www.ag.ch/de/aktuelles/medienportal/medienmitteilung/medienmitteilungen/mediendetails_139102.jsp
18.03.2020,NA,the meeting of the grand council of 28.04.2020 does not take place,cantonal,AG,https://www.ag.ch/de/aktuelles/medienportal/medienmitteilung/medienmitteilungen/mediendetails_139169.jsp
18.03.2020,NA,the parlamentary fraction (grand council) of 12.05.2020 is cancelled,cantonal,AG,https://www.ag.ch/de/aktuelles/medienportal/medienmitteilung/medienmitteilungen/mediendetails_139169.jsp
18.03.2020,19.04.2020,no parlamentary (grand council) commission meeting take place,cantonal,AG,https://www.ag.ch/de/aktuelles/medienportal/medienmitteilung/medienmitteilungen/mediendetails_139169.jsp
19.03.2020,NA,"construction sites are still allowed, but employers are mandated to enforce sanitary measures",cantonal,AG,https://www.ag.ch/de/aktuelles/medienportal/medienmitteilung/medienmitteilungen/mediendetails_139210.jsp
20.03.2020,NA,all acute hospitals with a performace mandate are obliged to recieve CoViD-19 patients,cantonal,AG,https://www.ag.ch/de/aktuelles/medienportal/medienmitteilung/medienmitteilungen/mediendetails_139223.jsp
20.03.2020,NA,4 hospitals are designated to recieve critical CoViD-19 patients,cantonal,AG,https://www.ag.ch/de/aktuelles/medienportal/medienmitteilung/medienmitteilungen/mediendetails_139223.jsp
20.03.2020,NA,hospitals with existing ICUs must increase their capacity to the maximum,cantonal,AG,https://www.ag.ch/de/aktuelles/medienportal/medienmitteilung/medienmitteilungen/mediendetails_139223.jsp
20.03.2020,NA,hospitals with intermediate care beds must increase their capacity to the maximum,cantonal,AG,https://www.ag.ch/de/aktuelles/medienportal/medienmitteilung/medienmitteilungen/mediendetails_139223.jsp
20.03.2020,NA,all acute hospitals must postpone all non essential operation and diminish the number of operation rooms in order to free respirators for ICUs,cantonal,AG,https://www.ag.ch/de/aktuelles/medienportal/medienmitteilung/medienmitteilungen/mediendetails_139223.jsp
20.03.2020,NA,regional hospital relieve acute hospitals by treating light CoViD-19 cases,cantonal,AG,https://www.ag.ch/de/aktuelles/medienportal/medienmitteilung/medienmitteilungen/mediendetails_139223.jsp
20.03.2020,NA,"in private household we recomend to through PPE, paper towels and hygene items right away in rubbish bags",cantonal,AG,https://www.ag.ch/de/aktuelles/medienportal/medienmitteilung/medienmitteilungen/mediendetails_139215.jsp
20.03.2020,NA,in households with people infected with CoViD-19 or in quarantine all the garbage should be disposed via rubbish bag,cantonal,AG,https://www.ag.ch/de/aktuelles/medienportal/medienmitteilung/medienmitteilungen/mediendetails_139215.jsp
20.03.2020,NA,Only go to collection points if absolutely necessary. Non-perishable and clean waste for separate collection should be stored at home if possible.,cantonal,AG,https://www.ag.ch/de/aktuelles/medienportal/medienmitteilung/medienmitteilungen/mediendetails_139215.jsp
20.03.2020,NA,"recycling centers should still remain open, but sanitary measures have to be enforced strictly",cantonal,AG,https://www.ag.ch/de/aktuelles/medienportal/medienmitteilung/medienmitteilungen/mediendetails_139215.jsp
16.03.2020,30.04.2020,"ban on all public, private and religious events, as well as gatherings with more than 50 people"" , canton, BL, //www.baselland.ch/politik-und-behorden/regierungsrat/medienmitteilungen/regierungsrat-beschliesst-weitergehende-massnahmen-um-die-ausbreitung-des-coronavirus-einzudaemmen/pdf/weitere-massnahmen-covid19-rrb.pdf/@@download/file/Weitere-Massnahmen-Covid19_RRB.pdf
16.03.2020, 30.04.2020, ""the council of state can allow events of pubblic interest with more than 50 people"" , canton, BL, //www.baselland.ch/politik-und-behorden/regierungsrat/medienmitteilungen/regierungsrat-beschliesst-weitergehende-massnahmen-um-die-ausbreitung-des-coronavirus-einzudaemmen/pdf/weitere-massnahmen-covid19-rrb.pdf/@@download/file/Weitere-Massnahmen-Covid19_RRB.pdf
16.03.2020, 30.04.2020, ""ban on all activities for associations and similar organizations like sport events, trainings and rehersals"" , canton, BL, //www.baselland.ch/politik-und-behorden/regierungsrat/medienmitteilungen/regierungsrat-beschliesst-weitergehende-massnahmen-um-die-ausbreitung-des-coronavirus-einzudaemmen/pdf/weitere-massnahmen-covid19-rrb.pdf/@@download/file/Weitere-Massnahmen-Covid19_RRB.pdf
16.03.2020, 30.04.2020, ""seniors and individuals with comorbidity are recommended not to supervise children"" , canton, BL, //www.baselland.ch/politik-und-behorden/regierungsrat/medienmitteilungen/regierungsrat-beschliesst-weitergehende-massnahmen-um-die-ausbreitung-des-coronavirus-einzudaemmen/pdf/weitere-massnahmen-covid19-rrb.pdf/@@download/file/Weitere-Massnahmen-Covid19_RRB.pdf
16.03.2020, 30.04.2020, ""seniors and individuals with comorbidity are rocommended not to take part in pubblic or private events"" , canton, BL, //www.baselland.ch/politik-und-behorden/regierungsrat/medienmitteilungen/regierungsrat-beschliesst-weitergehende-massnahmen-um-die-ausbreitung-des-coronavirus-einzudaemmen/pdf/weitere-massnahmen-covid19-rrb.pdf/@@download/file/Weitere-Massnahmen-Covid19_RRB.pdf
16.03.2020, 30.04.2020, ""seniors and individuals with comorbidity are rocommended not to take pubblic transportations except for medical reasons, work or buying groceries"" , canton, BL, //www.baselland.ch/politik-und-behorden/regierungsrat/medienmitteilungen/regierungsrat-beschliesst-weitergehende-massnahmen-um-die-ausbreitung-des-coronavirus-einzudaemmen/pdf/weitere-massnahmen-covid19-rrb.pdf/@@download/file/Weitere-Massnahmen-Covid19_RRB.pdf
16.03.2020, 30.04.2020, ""public transportations, with exception of SBB and taxis, shall take measures to reduce the places per wagon to a maximum of a half the nominal capacity"" , canton, BL, //www.baselland.ch/politik-und-behorden/regierungsrat/medienmitteilungen/regierungsrat-beschliesst-weitergehende-massnahmen-um-die-ausbreitung-des-coronavirus-einzudaemmen/pdf/weitere-massnahmen-covid19-rrb.pdf/@@download/file/Weitere-Massnahmen-Covid19_RRB.pdf
16.03.2020, 30.04.2020, ""shops of non-primary necessity, are closed. Areas of non-primary necessity are to delimit and close in larger shops."" , canton, BL, //www.baselland.ch/politik-und-behorden/regierungsrat/medienmitteilungen/regierungsrat-beschliesst-weitergehende-massnahmen-um-die-ausbreitung-des-coronavirus-einzudaemmen/pdf/weitere-massnahmen-covid19-rrb.pdf/@@download/file/Weitere-Massnahmen-Covid19_RRB.pdf
16.03.2020, 30.04.2020, ""shops of primary necessity are asked to guarantee social distancing (BAG: 1 person / 4m2)"" , canton, BL, //www.baselland.ch/politik-und-behorden/regierungsrat/medienmitteilungen/regierungsrat-beschliesst-weitergehende-massnahmen-um-die-ausbreitung-des-coronavirus-einzudaemmen/pdf/weitere-massnahmen-covid19-rrb.pdf/@@download/file/Weitere-Massnahmen-Covid19_RRB.pdf
16.03.2020, 30.04.2020, ""restaurants, hotels and many other categories are mandated to cease activities"" , canton, BL, //www.baselland.ch/politik-und-behorden/regierungsrat/medienmitteilungen/regierungsrat-beschliesst-weitergehende-massnahmen-um-die-ausbreitung-des-coronavirus-einzudaemmen/pdf/weitere-massnahmen-covid19-rrb.pdf/@@download/file/Weitere-Massnahmen-Covid19_RRB.pdf
16.03.2020, 30.04.2020, ""the cantonal hospital of Bruderholz is reference hospital for COVID-19"" , canton, BL, //www.baselland.ch/politik-und-behorden/regierungsrat/medienmitteilungen/regierungsrat-beschliesst-weitergehende-massnahmen-um-die-ausbreitung-des-coronavirus-einzudaemmen/pdf/weitere-massnahmen-covid19-rrb.pdf/@@download/file/Weitere-Massnahmen-Covid19_RRB.pdf
16.03.2020, 30.04.2020, ""hospitals must refrain all immediately necessary operations"" , canton, BL, //www.baselland.ch/politik-und-behorden/regierungsrat/medienmitteilungen/regierungsrat-beschliesst-weitergehende-massnahmen-um-die-ausbreitung-des-coronavirus-einzudaemmen/pdf/weitere-massnahmen-covid19-rrb.pdf/@@download/file/Weitere-Massnahmen-Covid19_RRB.pdf
16.03.2020, 30.04.2020, ""in hospitals and hospices, the visit of patients at risk is prohibited"" , canton, BL, //www.baselland.ch/politik-und-behorden/regierungsrat/medienmitteilungen/regierungsrat-beschliesst-weitergehende-massnahmen-um-die-ausbreitung-des-coronavirus-einzudaemmen/pdf/weitere-massnahmen-covid19-rrb.pdf/@@download/file/Weitere-Massnahmen-Covid19_RRB.pdf
16.03.2020, 30.04.2020, ""cantonal authorities are allowed to requisition necessary tools to handle the emergency"" , canton, BL, //www.baselland.ch/politik-und-behorden/regierungsrat/medienmitteilungen/regierungsrat-beschliesst-weitergehende-massnahmen-um-die-ausbreitung-des-coronavirus-einzudaemmen/pdf/weitere-massnahmen-covid19-rrb.pdf/@@download/file/Weitere-Massnahmen-Covid19_RRB.pdf
16.03.2020, 30.04.2020, ""where possible, the cantonal administration works in home office"" , canton, BL, //www.baselland.ch/politik-und-behorden/regierungsrat/medienmitteilungen/regierungsrat-beschliesst-weitergehende-massnahmen-um-die-ausbreitung-des-coronavirus-einzudaemmen/pdf/weitere-massnahmen-covid19-rrb.pdf/@@download/file/Weitere-Massnahmen-Covid19_RRB.pdf
16.03.2020, 30.04.2020, ""the public access to buildings of the cantonal administration is reduced to the minimum"" , canton, BL, //www.baselland.ch/politik-und-behorden/regierungsrat/medienmitteilungen/regierungsrat-beschliesst-weitergehende-massnahmen-um-die-ausbreitung-des-coronavirus-einzudaemmen/pdf/weitere-massnahmen-covid19-rrb.pdf/@@download/file/Weitere-Massnahmen-Covid19_RRB.pdf
16.03.2020, 30.04.2020, ""orientation days of the army and civil protection are cancelled"" , canton, BL, //www.baselland.ch/politik-und-behorden/regierungsrat/medienmitteilungen/regierungsrat-beschliesst-weitergehende-massnahmen-um-die-ausbreitung-des-coronavirus-einzudaemmen/pdf/weitere-massnahmen-covid19-rrb.pdf/@@download/file/Weitere-Massnahmen-Covid19_RRB.pdf
02.03.2020, 09.03.2020, ""temporary disallowance of nuit blance permits in the context of carnival",canton,BL,://www.baselland.ch/politik-und-behorden/regierungsrat/medienmitteilungen/coronavirus-regierungsrat-informiert-ueber-die-durchsetzung-des-bundesratsentscheids/pdf/aufhebung-freinachtsbewilligung-fasnacht-2020.pdf/@@download/file/Aufhebung-Freinachtsbewilligung-Fasnacht-2020.pdf
19.03.2020,NA,postponement of the swearing in of the Swiss Guard to October 2020,canton,BL,//www.baselland.ch/politik-und-behorden/regierungsrat/medienmitteilungen/verschiebung-der-vereidigung-der-paepstlichen-schweizergarde-auf-oktober-2020
19.03.2020,NA,communal elections and votation scheduled for the 17.05.2020 are postponed,canton,BL,www.baselland.ch/politik-und-behorden/regierungsrat/medienmitteilungen/keine-gemeindewahlen-und-abstimmungen-im-mai-und-juni-gemeindenachwahlen-vom-22-maerz-koennen-stattfinden
01.03.2020,02.03.2020,ban on serving food and drinks in Sissach and Liestal,canton,BL,www.baselland.ch/politik-und-behorden/direktionen/volkswirtschafts-und-gesundheitsdirektion/medienmitteilungen/coronavirus-regierungsrat-verfuegt-ein-temporaeres-ausschankverbot-ab-1-maerz-19-00-bis-morgen-2-maerz-2020-06-00-in-liestal-und-sissach/downloads/Temporaeres-Ausschankverbot-Fasnacht-2020_Verfuegung_Medien.pdf/@@download/file/Tempor%C3%A4res-Ausschankverbot-Fasnacht-2020_Verf%C3%BCgung_Medien.pdf
28.02.2020,NA,prohibition on all organized events in the context of Carnival 2020,cantonal,BS,//www.bs.ch/nm/2020-coronavirus-basler-fasnacht-findet-nicht-statt-rr.html
28.02.2020,NA,recommendation to stay at home when sick and to contact a general practitioner,cantonal,BS,//www.bs.ch/nm/2020-coronavirus-basler-fasnacht-findet-nicht-statt-rr.html
28.02.2020,NA,"recommendation to cough and sneeze in a paper towel or, were that not at hand, in an armpit",cantonal,BS,//www.bs.ch/nm/2020-coronavirus-basler-fasnacht-findet-nicht-statt-rr.html
28.02.2020,NA,recommendation to wash hand several times a day with water and soap or a disinfectant,cantonal,BS,//www.bs.ch/nm/2020-coronavirus-basler-fasnacht-findet-nicht-statt-rr.html
28.02.2020,NA,recommendation to avoid contact with people suffering from acute respiratory diseases,cantonal,BS,//www.bs.ch/nm/2020-coronavirus-basler-fasnacht-findet-nicht-statt-rr.html
28.02.2020,NA,"in case of symptoms, contact a general practitioner or a health service",cantonal,BS,//www.bs.ch/nm/2020-coronavirus-basler-fasnacht-findet-nicht-statt-rr.html
28.02.2020,NA,"in case of symptoms, do not go to medical praxis without direction of a doctor",cantonal,BS,//www.bs.ch/nm/2020-coronavirus-basler-fasnacht-findet-nicht-statt-rr.html
